{
  "schemaVersion": "star-cluster-tl1-pds-calibration-v1",
  "id": "tl1-pds01-interception-study",
  "baselineSha256": "cff1b6caca7eb4d32d08a140fba3c645d98c1275ef13b4185f830dccfbd49d19",
  "masterSeed": 300100,
  "trialsPerVariant": 10000,
  "variants": [
    {
      "id": "pds-k-no-threat",
      "label": "Kinetic PDS readiness against kinetic-only opponent (A configuration)",
      "pairId": "pds-k-no-threat-swap",
      "shieldCapacity": 2,
      "shieldArmor": 0,
      "baseShieldRecharge": 1,
      "armorProtection": 0,
      "armorIntegrity": 4,
      "hull": 12,
      "rangeHexes": 2,
      "rangePenaltyPerHex": 5,
      "turnCap": 100,
      "sideA": {
        "family": "kinetic",
        "doctrine": "standard",
        "accuracy": 20,
        "computerBonus": 10,
        "evasive": false,
        "reactorOutput": 5,
        "ammunition": 100,
        "missileGuidance": 55,
        "missileDamage": 5,
        "missileShieldPenetration": 1,
        "missileArmorPenetration": 2,
        "missileSpeed": 1,
        "missileRange": 6,
        "targetMovePerTurn": 0,
        "missileLaunchesPerTurn": 1,
        "pdsFamily": "kinetic",
        "pdsPowerCost": 1,
        "pdsReactionCapacity": 1,
        "pdsInterceptionChance": 35,
        "pdsAmmunition": 50,
        "pdsUnlimitedAmmunition": false
      },
      "sideB": {
        "family": "kinetic",
        "doctrine": "standard",
        "accuracy": 20,
        "computerBonus": 10,
        "evasive": false,
        "reactorOutput": 5,
        "ammunition": 100,
        "missileGuidance": 55,
        "missileDamage": 5,
        "missileShieldPenetration": 1,
        "missileArmorPenetration": 2,
        "missileSpeed": 1,
        "missileRange": 6,
        "targetMovePerTurn": 0,
        "missileLaunchesPerTurn": 1,
        "pdsFamily": "none",
        "pdsPowerCost": 0,
        "pdsReactionCapacity": 0,
        "pdsInterceptionChance": 0,
        "pdsAmmunition": 0,
        "pdsUnlimitedAmmunition": false
      }
    },
    {
      "id": "pds-k-no-threat-swap",
      "label": "Kinetic PDS readiness against kinetic-only opponent (side-swapped)",
      "pairId": "pds-k-no-threat",
      "shieldCapacity": 2,
      "shieldArmor": 0,
      "baseShieldRecharge": 1,
      "armorProtection": 0,
      "armorIntegrity": 4,
      "hull": 12,
      "rangeHexes": 2,
      "rangePenaltyPerHex": 5,
      "turnCap": 100,
      "sideA": {
        "family": "kinetic",
        "doctrine": "standard",
        "accuracy": 20,
        "computerBonus": 10,
        "evasive": false,
        "reactorOutput": 5,
        "ammunition": 100,
        "missileGuidance": 55,
        "missileDamage": 5,
        "missileShieldPenetration": 1,
        "missileArmorPenetration": 2,
        "missileSpeed": 1,
        "missileRange": 6,
        "targetMovePerTurn": 0,
        "missileLaunchesPerTurn": 1,
        "pdsFamily": "none",
        "pdsPowerCost": 0,
        "pdsReactionCapacity": 0,
        "pdsInterceptionChance": 0,
        "pdsAmmunition": 0,
        "pdsUnlimitedAmmunition": false
      },
      "sideB": {
        "family": "kinetic",
        "doctrine": "standard",
        "accuracy": 20,
        "computerBonus": 10,
        "evasive": false,
        "reactorOutput": 5,
        "ammunition": 100,
        "missileGuidance": 55,
        "missileDamage": 5,
        "missileShieldPenetration": 1,
        "missileArmorPenetration": 2,
        "missileSpeed": 1,
        "missileRange": 6,
        "targetMovePerTurn": 0,
        "missileLaunchesPerTurn": 1,
        "pdsFamily": "kinetic",
        "pdsPowerCost": 1,
        "pdsReactionCapacity": 1,
        "pdsInterceptionChance": 35,
        "pdsAmmunition": 50,
        "pdsUnlimitedAmmunition": false
      }
    },
    {
      "id": "pds-e-no-threat",
      "label": "Energy PDS readiness against energy-only opponent (A configuration)",
      "pairId": "pds-e-no-threat-swap",
      "shieldCapacity": 2,
      "shieldArmor": 0,
      "baseShieldRecharge": 1,
      "armorProtection": 0,
      "armorIntegrity": 4,
      "hull": 12,
      "rangeHexes": 2,
      "rangePenaltyPerHex": 5,
      "turnCap": 100,
      "sideA": {
        "family": "energy",
        "doctrine": "standard",
        "accuracy": 25,
        "computerBonus": 10,
        "evasive": false,
        "reactorOutput": 5,
        "ammunition": 0,
        "missileGuidance": 55,
        "missileDamage": 5,
        "missileShieldPenetration": 1,
        "missileArmorPenetration": 2,
        "missileSpeed": 1,
        "missileRange": 6,
        "targetMovePerTurn": 0,
        "missileLaunchesPerTurn": 1,
        "pdsFamily": "energy",
        "pdsPowerCost": 2,
        "pdsReactionCapacity": 1,
        "pdsInterceptionChance": 40,
        "pdsAmmunition": 0,
        "pdsUnlimitedAmmunition": true
      },
      "sideB": {
        "family": "energy",
        "doctrine": "standard",
        "accuracy": 25,
        "computerBonus": 10,
        "evasive": false,
        "reactorOutput": 5,
        "ammunition": 0,
        "missileGuidance": 55,
        "missileDamage": 5,
        "missileShieldPenetration": 1,
        "missileArmorPenetration": 2,
        "missileSpeed": 1,
        "missileRange": 6,
        "targetMovePerTurn": 0,
        "missileLaunchesPerTurn": 1,
        "pdsFamily": "none",
        "pdsPowerCost": 0,
        "pdsReactionCapacity": 0,
        "pdsInterceptionChance": 0,
        "pdsAmmunition": 0,
        "pdsUnlimitedAmmunition": false
      }
    },
    {
      "id": "pds-e-no-threat-swap",
      "label": "Energy PDS readiness against energy-only opponent (side-swapped)",
      "pairId": "pds-e-no-threat",
      "shieldCapacity": 2,
      "shieldArmor": 0,
      "baseShieldRecharge": 1,
      "armorProtection": 0,
      "armorIntegrity": 4,
      "hull": 12,
      "rangeHexes": 2,
      "rangePenaltyPerHex": 5,
      "turnCap": 100,
      "sideA": {
        "family": "energy",
        "doctrine": "standard",
        "accuracy": 25,
        "computerBonus": 10,
        "evasive": false,
        "reactorOutput": 5,
        "ammunition": 0,
        "missileGuidance": 55,
        "missileDamage": 5,
        "missileShieldPenetration": 1,
        "missileArmorPenetration": 2,
        "missileSpeed": 1,
        "missileRange": 6,
        "targetMovePerTurn": 0,
        "missileLaunchesPerTurn": 1,
        "pdsFamily": "none",
        "pdsPowerCost": 0,
        "pdsReactionCapacity": 0,
        "pdsInterceptionChance": 0,
        "pdsAmmunition": 0,
        "pdsUnlimitedAmmunition": false
      },
      "sideB": {
        "family": "energy",
        "doctrine": "standard",
        "accuracy": 25,
        "computerBonus": 10,
        "evasive": false,
        "reactorOutput": 5,
        "ammunition": 0,
        "missileGuidance": 55,
        "missileDamage": 5,
        "missileShieldPenetration": 1,
        "missileArmorPenetration": 2,
        "missileSpeed": 1,
        "missileRange": 6,
        "targetMovePerTurn": 0,
        "missileLaunchesPerTurn": 1,
        "pdsFamily": "energy",
        "pdsPowerCost": 2,
        "pdsReactionCapacity": 1,
        "pdsInterceptionChance": 40,
        "pdsAmmunition": 0,
        "pdsUnlimitedAmmunition": true
      }
    },
    {
      "id": "pds-kpds-v-m-r0",
      "label": "Kinetic PDS kinetic ship versus ordinary missile ship at range 0 (A configuration)",
      "pairId": "pds-kpds-v-m-r0-swap",
      "shieldCapacity": 2,
      "shieldArmor": 0,
      "baseShieldRecharge": 1,
      "armorProtection": 0,
      "armorIntegrity": 4,
      "hull": 12,
      "rangeHexes": 0,
      "rangePenaltyPerHex": 5,
      "turnCap": 100,
      "sideA": {
        "family": "kinetic",
        "doctrine": "standard",
        "accuracy": 20,
        "computerBonus": 10,
        "evasive": false,
        "reactorOutput": 5,
        "ammunition": 100,
        "missileGuidance": 55,
        "missileDamage": 5,
        "missileShieldPenetration": 1,
        "missileArmorPenetration": 2,
        "missileSpeed": 1,
        "missileRange": 6,
        "targetMovePerTurn": 0,
        "missileLaunchesPerTurn": 1,
        "pdsFamily": "kinetic",
        "pdsPowerCost": 1,
        "pdsReactionCapacity": 1,
        "pdsInterceptionChance": 35,
        "pdsAmmunition": 50,
        "pdsUnlimitedAmmunition": false
      },
      "sideB": {
        "family": "missile",
        "doctrine": "standard",
        "accuracy": 0,
        "computerBonus": 0,
        "evasive": false,
        "reactorOutput": 5,
        "ammunition": 25,
        "missileGuidance": 55,
        "missileDamage": 5,
        "missileShieldPenetration": 1,
        "missileArmorPenetration": 2,
        "missileSpeed": 1,
        "missileRange": 6,
        "targetMovePerTurn": 0,
        "missileLaunchesPerTurn": 1,
        "pdsFamily": "none",
        "pdsPowerCost": 0,
        "pdsReactionCapacity": 0,
        "pdsInterceptionChance": 0,
        "pdsAmmunition": 0,
        "pdsUnlimitedAmmunition": false
      }
    },
    {
      "id": "pds-kpds-v-m-r0-swap",
      "label": "Kinetic PDS kinetic ship versus ordinary missile ship at range 0 (side-swapped)",
      "pairId": "pds-kpds-v-m-r0",
      "shieldCapacity": 2,
      "shieldArmor": 0,
      "baseShieldRecharge": 1,
      "armorProtection": 0,
      "armorIntegrity": 4,
      "hull": 12,
      "rangeHexes": 0,
      "rangePenaltyPerHex": 5,
      "turnCap": 100,
      "sideA": {
        "family": "missile",
        "doctrine": "standard",
        "accuracy": 0,
        "computerBonus": 0,
        "evasive": false,
        "reactorOutput": 5,
        "ammunition": 25,
        "missileGuidance": 55,
        "missileDamage": 5,
        "missileShieldPenetration": 1,
        "missileArmorPenetration": 2,
        "missileSpeed": 1,
        "missileRange": 6,
        "targetMovePerTurn": 0,
        "missileLaunchesPerTurn": 1,
        "pdsFamily": "none",
        "pdsPowerCost": 0,
        "pdsReactionCapacity": 0,